<?xml version="1.0" encoding="UTF-8"?>
<ns1:env    xmlns:xsi='http://www.w3.org/2001/XMLSchema-instance'
    xmlns:ns1='http://aeneas.bsc.es/MatchingModel'
    xsi:schemaLocation='http://aeneas.bsc.es/MatchingModel file:/home/ccugnasc/workspace/aeneas/aeneas-core/model/src/main/resources/MatchingModel.xsd'>
    <ns1:cluster name="prova" address="127.0.0.1">
        <ns1:settings></ns1:settings>
        <ns1:matches>
            <ns1:match name="CustomersCreate" crudType="CREATE">
                <ns1:refPath>
                    <ns1:level name="users">
                    </ns1:level>
                    <ns1:level name="userid">
                    </ns1:level>
                </ns1:refPath>
            </ns1:match>
         
            <ns1:match name="" crudType="">
                <ns1:fixedDests>
                    <ns1:fixedDest fixedValue="" fixedValueType="UTF8Type">
                        <ns1:dest attr="" where="">
                        </ns1:dest>
                    </ns1:fixedDest>
                </ns1:fixedDests>
                <ns1:refPath>
                    <ns1:level name="">
                    </ns1:level>
                </ns1:refPath>
            </ns1:match>
        </ns1:matches>
    </ns1:cluster>
     

</ns1:env>
